drop table if exists t1,t2;
create table t1 (a int auto_increment , primary key (a));
insert into t1 values (NULL),(NULL),(NULL),(NULL),(NULL),(NULL),(NULL),(NULL),(NULL),(NULL),(NULL),(NULL),(NULL),(NULL),(NULL),(NULL),(NULL),(NULL),(NULL),(NULL),(NULL),(NULL),(NULL),(NULL),(NULL),(NULL),(NULL),(NULL),(NULL),(NULL),(NULL),(NULL),(NULL),(NULL),(NULL),(NULL);
update t1 set a=a+10 where a > 34;
update t1 set a=a+100 where a > 0;
update t1 set a=a+100 where a=1 and a=2;
update t1 set a=b+100 where a=1 and a=2;
Error 1105: unknown column b
update t1 set a=b+100 where c=1 and a=2;
Error 1105: unknown column b
update t1 set d=a+100 where a=1;
Error 1105: column d not found
select * from t1;
a
101
102
103
104
105
106
107
108
109
110
111
112
113
114
115
116
117
118
119
120
121
122
123
124
125
126
127
128
129
130
131
132
133
134
145
146
drop table t1;
CREATE TABLE t1
(
place_id int (10) unsigned NOT NULL,
shows int(10) unsigned DEFAULT '0' NOT NULL,
ishows int(10) unsigned DEFAULT '0' NOT NULL,
ushows int(10) unsigned DEFAULT '0' NOT NULL,
clicks int(10) unsigned DEFAULT '0' NOT NULL,
iclicks int(10) unsigned DEFAULT '0' NOT NULL,
uclicks int(10) unsigned DEFAULT '0' NOT NULL,
ts timestamp,
PRIMARY KEY (place_id,ts)
);
INSERT INTO t1 (place_id,shows,ishows,ushows,clicks,iclicks,uclicks,ts)
VALUES (1,0,0,0,0,0,0,20000928174434);
UPDATE t1 SET shows=shows+1,ishows=ishows+1,ushows=ushows+1,clicks=clicks+1,iclicks=iclicks+1,uclicks=uclicks+1 WHERE place_id=1 AND ts>="2000-09-28 00:00:00";
select place_id,shows from t1;
place_id	shows
1	1
drop table t1;
CREATE TABLE t1 (
lfdnr int(10) unsigned NOT NULL default '0',
ticket int(10) unsigned NOT NULL default '0',
client varchar(255) NOT NULL default '',
replyto varchar(255) NOT NULL default '',
subject varchar(100) NOT NULL default '',
timestamp int(10) unsigned NOT NULL default '0',
tstamp timestamp NOT NULL,
status int(3) NOT NULL default '0',
type varchar(15) NOT NULL default '',
assignment int(10) unsigned NOT NULL default '0',
fupcount int(4) unsigned NOT NULL default '0',
parent int(10) unsigned NOT NULL default '0',
activity int(10) unsigned NOT NULL default '0',
priority tinyint(1) unsigned NOT NULL default '1',
cc varchar(255) NOT NULL default '',
bcc varchar(255) NOT NULL default '',
body text NOT NULL,
comment text,
header text,
PRIMARY KEY  (lfdnr),
KEY k1 (timestamp),
KEY k2 (type),
KEY k3 (parent),
KEY k4 (assignment),
KEY ticket (ticket)
) ENGINE=MyISAM;
INSERT INTO t1 VALUES (773,773,'','','',980257344,20010318180652,0,'Open',10,0,0,0,1,'','','','','');
drop table t1;
CREATE TABLE t1 (
`id_param` smallint(3) unsigned NOT NULL default '0',
`nom_option` char(40) NOT NULL default '',
`valid` tinyint(1) NOT NULL default '0',
KEY `id_param` (`id_param`,`nom_option`)
) ENGINE=MyISAM;
INSERT INTO t1 (id_param,nom_option,valid) VALUES (185,'600x1200',1);
UPDATE t1 SET nom_option='test' WHERE id_param=185 AND nom_option='600x1200' AND valid=1 LIMIT 1;
select * from t1;
id_param	nom_option	valid
185	test	1
drop table t1;
create table t1 (F1 VARCHAR(30), F2 VARCHAR(30), F3 VARCHAR(30), cnt int, groupid int, KEY groupid_index (groupid));
insert into t1 (F1,F2,F3,cnt,groupid) values ('0','0','0',1,6),
('0','1','2',1,5), ('0','2','0',1,3), ('1','0','1',1,2),
('1','2','1',1,1), ('1','2','2',1,1), ('2','0','1',2,4),
('2','2','0',1,7);
delete from m1 using t1 m1,t1 m2 where m1.groupid=m2.groupid and (m1.cnt < m2.cnt or m1.cnt=m2.cnt and m1.F3>m2.F3);
select * from t1;
F1	F2	F3	cnt	groupid
0	0	0	1	6
0	1	2	1	5
0	2	0	1	3
1	0	1	1	2
1	2	1	1	1
2	0	1	2	4
2	2	0	1	7
drop table t1;
create table t1 (c1 int, c2 char(6), c3 int);
create table t2 (c1 int, c2 char(6));
insert into t1 values (1, "t1c2-1", 10), (2, "t1c2-2", 20);
update t1 left join t2 on t1.c1 = t2.c1 set t2.c2 = "t2c2-1";
update t1 left join t2 on t1.c1 = t2.c1 set t2.c2 = "t2c2-1" where t1.c3 = 10;
drop table t1, t2;
create table t1 (id int not null auto_increment primary key, id_str varchar(32));
insert into t1 (id_str) values ("test");
update t1 set id_str = concat(id_str, id) where id = last_insert_id();
select * from t1;
id	id_str
1	test1
drop table t1;
create table t1 (a int, b char(255), key(a, b(20)));
insert into t1 values (0, '1');
update t1 set b = b + 1 where a = 0;
select * from t1;
a	b
0	2
drop table t1;
create table t1 (a int, b varchar(10), key b(b(5))) engine=myisam;
create table t2 (a int, b varchar(10)) engine=myisam;
insert into t1 values ( 1, 'abcd1e');
insert into t1 values ( 2, 'abcd2e');
insert into t2 values ( 1, 'abcd1e');
insert into t2 values ( 2, 'abcd2e');
update t1, t2 set t1.a = t2.a where t2.b = t1.b;
show warnings;
Level	Code	Message
drop table t1, t2;
create table t1 ( a int, b int default 0, index (a) );
insert into t1 (a) values (0),(0),(0),(0),(0),(0),(0),(0);
select a from t1 order by a limit 1;
a
0
show status like 'handler_read%';
Variable_name	Value
update t1 set a=9999 order by a limit 1;
update t1 set b=9999 order by a limit 1;
show status like 'handler_read%';
Variable_name	Value
delete from t1 order by a limit 1;
show status like 'handler_read%';
Variable_name	Value
delete from t1 order by a desc limit 1;
show status like 'handler_read%';
Variable_name	Value
delete from t1 order by a limit 1;
show status like 'handler_read%';
Variable_name	Value
select * from t1;
a	b
0	0
0	0
0	0
0	0
0	0
update t1 set a=a+10,b=1 order by a limit 3;
update t1 set a=a+11,b=2 order by a limit 3;
update t1 set a=a+12,b=3 order by a limit 3;
select * from t1 order by a;
a	b
11	2
21	2
22	3
22	3
23	3
drop table t1;
create table t1 (f1 int);
create table t2 (f2 int);
insert into t1 values(1),(2);
insert into t2 values(1),(1);
update t1,t2 set f1=3,f2=3 where f1=f2 and f1=1;
update t2 set f2=1;
update t1 set f1=1 where f1=3;
update t2,t1 set f1=3,f2=3 where f1=f2 and f1=1;
drop table t1,t2;
create table t1 (a int);
insert into t1 values (0),(1),(2),(3),(4),(5),(6),(7),(8),(9);
create table t2 (a int, filler1 char(200), filler2 char(200), key(a));
insert into t2 select A.a + 10*B.a, 'filler','filler' from t1 A, t1 B;
update t2 set a=3 where a=2;
show status like 'handler_read%';
Variable_name	Value
drop table t1, t2;
create table t1(f1 int, `*f2` int);
insert into t1 values (1,1);
update t1 set `*f2`=1;
drop table t1;
create table t1(f1 int);
update t1 set f2=1 order by f2;
Error 1105: unknown column f2
drop table t1;
CREATE TABLE t1 (
request_id int unsigned NOT NULL auto_increment,
user_id varchar(12) default NULL,
time_stamp datetime NOT NULL default '0000-00-00 00:00:00',
ip_address varchar(15) default NULL,
PRIMARY KEY (request_id),
KEY user_id_2 (user_id,time_stamp)
);
INSERT INTO t1 (user_id) VALUES ('user1');
INSERT INTO t1(user_id) SELECT user_id FROM t1;
INSERT INTO t1(user_id) SELECT user_id FROM t1;
INSERT INTO t1(user_id) SELECT user_id FROM t1;
INSERT INTO t1(user_id) SELECT user_id FROM t1;
INSERT INTO t1(user_id) SELECT user_id FROM t1;
INSERT INTO t1(user_id) SELECT user_id FROM t1;
INSERT INTO t1(user_id) SELECT user_id FROM t1;
INSERT INTO t1(user_id) SELECT user_id FROM t1;
SELECT user_id FROM t1 WHERE request_id=9999999999999;
user_id
show status like '%Handler_read%';
Variable_name	Value
UPDATE t1 SET user_id=null WHERE request_id=9999999999999;
show status like '%Handler_read%';
Variable_name	Value
DROP TABLE t1;
CREATE TABLE t1 (
a INT(11),
quux decimal( 31, 30 ),
UNIQUE KEY bar (a),
KEY quux (quux)
);
INSERT INTO
t1 ( a, quux )
VALUES
( 1,    1 ),
( 2,  0.1 );
INSERT INTO t1( a )
SELECT @newA := 1 + a FROM t1 WHERE quux <= 0.1;
SELECT * FROM t1;
a	quux
1	1.000000000000000000000000000000
2	0.100000000000000000000000000000
3	NULL
DROP TABLE t1;
set tmp_table_size=1024;
create table t1 (id int, a int, key idx(a));
create table t2 (id int unsigned not null auto_increment primary key, a int);
insert into t2(a) values(1),(2),(3),(4),(5),(6),(7),(8);
insert into t2(a) select a from t2;
insert into t2(a) select a from t2;
insert into t2(a) select a from t2;
update t2 set a=id;
insert into t1 select * from t2;
select count(*) from t1 join t2 on (t1.a=t2.a);
count(*)
64
update t1 join t2 on (t1.a=t2.a) set t1.id=t2.id;
insert into t2(a) select a from t2;
update t2 set a=id;
truncate t1;
insert into t1 select * from t2;
select count(*) from t1 join t2 on (t1.a=t2.a);
count(*)
128
update t1 join t2 on (t1.a=t2.a) set t1.id=t2.id;
update t1 set a=1;
update t2 set a=1;
select count(*) from t1 join t2 on (t1.a=t2.a);
count(*)
16384
update t1 join t2 on (t1.a=t2.a) set t1.id=t2.id;
drop table t1,t2;
#
# Verify that UPDATE does the same number of handler_update
# operations, no matter if there is ORDER BY or not.
#
CREATE TABLE t1 (i INT) ENGINE=INNODB;
INSERT INTO t1 VALUES (10),(11),(12),(13),(14),(15),(16),(17),(18),(19),
(20),(21),(22),(23),(24),(25),(26),(27),(28),(29),
(30),(31),(32),(33),(34),(35);
CREATE TABLE t2 (a CHAR(2), b CHAR(2), c CHAR(2), d CHAR(2),
INDEX idx (a,b(1),c)) ENGINE=INNODB;
INSERT INTO t2 SELECT i, i, i, i FROM t1;
START TRANSACTION;
UPDATE t2 SET d = 10 WHERE b = 10 LIMIT 5;
SHOW STATUS LIKE 'HANDLER_UPDATE';
Variable_name	Value
ROLLBACK;
START TRANSACTION;
UPDATE t2 SET d = 10 WHERE b = 10 ORDER BY a, c LIMIT 5;
SHOW STATUS LIKE 'HANDLER_UPDATE';
Variable_name	Value
ROLLBACK;
